<?xml version="1.0" encoding="UTF-8"?><MTO_SchedineRQ xmlns:xs="http://www.w3.org/2001/XMLSchema" xsi:schemaLocation="http://ws.webci.it/webci.xsd" Version="1.0" PrimaryLangID="it"><POS><Source><RequestorID Type="4" ID="webci" MessagePassword="Prova7592" /></Source><Source><RequestorID Type="10" ID="052004ALB0013" MessagePassword="Prova7592" /></Source></POS><Aggiornamento><Ospite Id="231140" IdCamera="1602" TipoAlloggiato="17"><DataDiArrivo>2015-11-20</DataDiArrivo><DataDiPartenza>2015-11-21</DataDiPartenza><DataDiNascita>1996-01-01</DataDiNascita><Sesso>2</Sesso><Provenienza><Italia CodiceComune="" Provincia="" Stato="100000100" /></Provenienza><Nascita><Estero Stato="100000100" /></Nascita><Cittadinanza Stato="100000100" /><ImpostaDiSoggiorno><CodiceImpostaSoggiorno>MN</CodiceImpostaSoggiorno><ValoreImpostaUnitaria>1.00</ValoreImpostaUnitaria><NottiImponibili>2</NottiImponibili></ImpostaDiSoggiorno><CampiStatistici><TipoTurismo>Altro</TipoTurismo><MezzoDiTrasporto>Altro</MezzoDiTrasporto><TipoPrenotazione>Altro</TipoPrenotazione></CampiStatistici></Ospite></Aggiornamento></MTO_SchedineRQ>